language_uid,language_iso2,language_iso2_google,language_wals_code,language_name_fr,language_name_native,language_name_en,language_is_available,language_alpha3,language_genus_fr,language_desc,language_countries
ben,bn,bn,ben,Bengali,বাংলা,"Bengali, Bangla",TRUE,ben,Indique,"Le bengali ou bangla (বাংলা (bangla)) est une langue indo-iranienne (sous-branche indo-aryenne) de la famille des langues indo-européennes. Avec l'assamais, il s'agit de la plus orientale des langues indo-européennes.
Originaire de la région du Bengale à l’Est du sous-continent indien, première langue parlée au Bangladesh (en 2011, 76 % de la population l'ayant comme langue maternelle), soit 106 millions de locuteurs ainsi que 13,8 % en tant que seconde langue, soit 19 millions de locuteurs, pour un total de 126 millions de locuteurs) et 2e langue parlée, en Inde, environ 94 millions de locuteurs langue maternelle, soit environ 200 millions de locuteurs langue maternelle dans le monde en 2011, le bengali est la langue nationale du Bangladesh et langue officielle dans les États indiens du Bengale-Occidental, Tripura et certains districts d’Assam. En outre, il est parlé par d'importantes communautés en Amérique du Nord, Europe, Moyen-Orient, Sud-Est asiatique.
C'est la langue maternelle d’environ 200 millions de locuteurs (5e ou 6e rang au niveau mondial).
La langue bengalie dérive du prakrit magadhi, une forme vernaculaire de l’ancien sanskrit, comme d'autres langues dont les plus proches sont l’assamais et l’oriya. Le bengali s’est développé en 1000-1200 ap. J.-C. Une grande partie de son vocabulaire a été empruntée au sanskrit, tout en recevant un apport lexical arabo-persan important. Il a influencé un grand nombre de langues tibéto-birmanes du nord-est de l'Inde, en particulier le metei qui lui a emprunté son écriture.
Il est noté dans un semi-syllabaire qui lui est propre, dérivé de la brahmi et très proche de la devanagari, dont il respecte les principes généraux ; son tracé est cependant plus anguleux.
Le bengali par sa grande diversité de variantes régionales constitue un continuum linguistique.
Le 21 février 1952, plusieurs personnes furent tuées lors d'une manifestation pour la langue bengalie. Pour cette raison en 1999, l’UNESCO décide de commémorer tous les 21 février comme Journée internationale de la langue maternelle.
Les représentants les plus connus du bengali sont le lauréat du prix Nobel de littérature Rabindranath Tagore et l'écrivain cinéaste Satyajit Ray.","[{'alpha-2_code': 'BD', 'country_name_fr': 'Bangladesh', 'popularity': '100.00%', 'speakers ': '100,000,000', 'is_official ': 'FALSE', 'official': 'Majoritaire et langue officielle'}, {'alpha-2_code': 'IN', 'country_name_fr': 'Inde', 'popularity': '8.00%', 'speakers ': '85,000,000', 'is_official ': 'FALSE', 'official': ''}]"
urd,ur,ur,urd,Urdu,اردو,Urdu,TRUE,urd,Indique,"L'ourdou ou urdu (autonyme : اُردُو, urdū ou Lashkari لشکری, sous une forme plus longue lashkari zūban لشکری زبان ), est une langue appartenant au groupe indo-iranien de la famille des langues indo-européennes. Il est parlé dans le Nord de l'Inde, ainsi qu'au Pakistan, dont il est la langue officielle et le support de l'identité nationale. En Inde, il est une langue officielle reconnue par la Constitution. Il s'écrit en alphabet perso-arabe. Plus de 165 millions de personnes utilisent l'ourdou, dont 60 à 80 millions qui l'utilisent comme première langue.","[{'alpha-2_code': 'PK', 'country_name_fr': 'Pakistan', 'popularity': '100.00%', 'speakers ': '109,100,000', 'is_official ': 'TRUE', 'official': 'Langue officielle'}, {'alpha-2_code': 'BD', 'country_name_fr': 'Bangladesh', 'popularity': '10.00%', 'speakers ': '500,000', 'is_official ': 'FALSE', 'official': 'Minorité appelée Bihari'}, {'alpha-2_code': 'IN', 'country_name_fr': 'Inde', 'popularity': '', 'speakers ': '58,340,000', 'is_official ': 'FALSE', 'official': 'L’urdu est proche de l’hindi'}]"
bul,bg,bg,bul,Bulgare,Български,Bulgarian,TRUE,bul,Slave,"Le bulgare est une langue de la famille des langues indo-européennes appartenant au groupe des langues slaves et plus particulièrement aux langues slaves méridionales, l'un de ses trois sous-groupes. Elle forme un continuum linguistique avec les autres membres de ce sous-groupe dont les principaux sont le serbo-croate, le slovène, le macédonien et le vieux-slave.
La langue bulgare est la langue officielle de la Bulgarie, où elle est principalement parlée, et constitue l'une des 24 langues officielles de l'Union européenne. Des communautés bulgarophones existent également dans les pays voisins de la Bulgarie, tels que l'Ukraine, la Moldavie, la Macédoine, la Roumanie, la Grèce et la Turquie, mais aussi dans la périphérie ouest de la Serbie, ainsi que de plus petites communautés dans de nombreux autres pays du monde, pour un total de 8 à 10 millions de locuteurs.","[{'alpha-2_code': 'BG', 'country_name_fr': 'Bulgarie', 'popularity': '86%', 'speakers ': '5,659,024', 'is_official ': 'TRUE', 'official': 'Langue officielle.'}, {'alpha-2_code': 'MD', 'country_name_fr': 'Moldavie', 'popularity': '2.00%', 'speakers ': '54,401', 'is_official ': 'FALSE', 'official': ''}]"
dan,da,da,dsh,Danois,Dansk,Danish,TRUE,dan,Germanique,"Le danois est une langue germanique principalement parlée au Danemark par les Danois.
Langue officielle du Danemark et des îles Féroé (à parité avec le féroïen), langue seconde du Groenland, le danois est aussi une des langues officielles de l'Union européenne. Il est généralement intelligible par les locuteurs du norvégien et du suédois et reste très enseigné comme langue secondaire en Islande, ancienne dépendance danoise.
Le danois est régi au Danemark par le conseil de la langue danoise.","[{'alpha-2_code': 'DE', 'country_name_fr': 'Allemagne', 'popularity': '5.00%', 'speakers ': '4,000,000', 'is_official ': 'FALSE', 'official': ''}, {'alpha-2_code': 'DK', 'country_name_fr': 'Danemark', 'popularity': '100.00%', 'speakers ': '6,000,000', 'is_official ': 'TRUE', 'official': 'Langue officielle'}, {'alpha-2_code': 'GL', 'country_name_fr': 'Groenland', 'popularity': '12.00%', 'speakers ': '6,840', 'is_official ': 'TRUE', 'official': 'Langue officielle'}, {'alpha-2_code': 'FO', 'country_name_fr': 'Îles Féroé', 'popularity': '100.00%', 'speakers ': '80,000', 'is_official ': 'FALSE', 'official': 'Langue officielle'}, {'alpha-2_code': 'IS', 'country_name_fr': 'Islande', 'popularity': '75.00%', 'speakers ': '235,500', 'is_official ': 'FALSE', 'official': ''}]"
est,et,et,est,Estonien,Eesti keel,Estonian,TRUE,est,Finnic,"L’Estonien est une langue finno-ougrienne assez proche, mais distincte, du finnois. Il n’a donc rien de commun avec les langues baltes, letton et lituanien, indo-européennes l’une et l’autre. La population purement estonienne du pays dépasse de peu 1 million de personnes, soit 60 % du total. Les Russes continue institue une très forte minorité qui approche des 30 % auquel s’ajoute d’autres nationalités comme les Ukrainiens 2,5 % ou des Biélorusses 1,6 %. Une faible partie des Russes parle estonien, alors que la majorité des Estoniens comprends le russe.","[{'alpha-2_code': 'EE', 'country_name_fr': 'Estonie', 'popularity': '82.00%', 'speakers ': '984,000', 'is_official ': 'TRUE', 'official': 'Langue officielle'}]"
ita,it,it,ita,Italien,Italiano,Italian,TRUE,ita,Langues latines,"L'italien (en italien : italiano) est une langue appartenant au groupe des langues romanes de la famille indo-européenne. Il existe un très grand nombre de dialectes italo-romans.
Comme beaucoup de langues nationales, l'italien moderne est un dialecte qui a « réussi » en s'imposant comme langue propre à une région beaucoup plus vaste que sa région dialectale originelle. En l'occurrence, c'est le dialecte toscan, de Florence, Pise et Sienne, qui s'est imposé, quoique dans sa forme illustre (koinè littéraire à base florentine enrichie par des apports siciliens, latins et d'autres régions italiennes), non pas pour des raisons politiques comme c'est souvent le cas, mais en raison du prestige culturel qu'il véhiculait. Le toscan est en effet la langue dans laquelle ont écrit Dante Alighieri, Pétrarque et Boccace, considérés comme les trois plus grands écrivains italiens de la fin du Moyen Âge. C'est aussi la langue de la ville de Florence, réputée pour sa beauté architecturale et son histoire prospère. C'est donc sans surprise que l'italien fut pendant longtemps la langue internationale de la culture et des arts, et que le vocabulaire de toutes les langues européennes conserve jusqu'à nos jours un grand nombre de termes italiens (notamment en musique, lesquels sont même repris dans d'autres langues comme le japonais).
Les normes générales de grammaire italienne ne furent pourtant fixées qu'à la Renaissance, avec la réforme linguistique de Pietro Bembo, érudit vénitien collaborateur d'Alde Manuce, qui en exposa les idées fondamentales dans Gli Asolani.","[{'alpha-2_code': 'CH', 'country_name_fr': 'Suisse', 'popularity': '8.00%', 'speakers ': '471,000', 'is_official ': 'TRUE', 'official': ""Langue officielle avec le français, l'allemand et le romanche.\nDans le canton du Tessin, langue officielle et la langue principale de 83 % de la population soit 254 997 habitants.\nDans le canton des Grisons, langue officielle avec le romanche et l'allemand (majoritaire) et langue principale de 10,2 % de la population, principalement dans les vallées méridionales : Val Mesolcina, Val Calanca, Val Bregaglia et Val Poschiavo.""}, {'alpha-2_code': 'IT', 'country_name_fr': 'Italie', 'popularity': '100.00%', 'speakers ': '59,798,000', 'is_official ': 'TRUE', 'official': 'Langue officielle'}, {'alpha-2_code': 'SI', 'country_name_fr': 'Slovénie', 'popularity': '', 'speakers ': '', 'is_official ': 'FALSE', 'official': 'Langue officielle avec le slovène dans les trois communes côtières Capodistria/Koper, Isola/Izola et Pirano/Piran'}, {'alpha-2_code': 'ER', 'country_name_fr': 'Érythrée', 'popularity': '', 'speakers ': '', 'is_official ': 'FALSE', 'official': ''}]"
bal,--,--,blc,Baloutchi,بلۏچی‎,Baluchi,TRUE,bal,Iranien,"Le baloutche (nom local : بلوچی / baločī) est une langue appartenant au groupe iranien de la famille des langues indo-européennes. Il est parlé au Baloutchistan, qui est actuellement divisé entre l'Iran, l'Afghanistan et le Pakistan. Il est parlé également dans une partie du Turkménistan et à Oman.","[{'alpha-2_code': 'AF', 'country_name_fr': 'Afghanistan', 'popularity': '1.00%', 'speakers ': '100,000', 'is_official ': 'TRUE', 'official': 'Parlé dans le sud du pays'}, {'alpha-2_code': 'IR', 'country_name_fr': 'Iran', 'popularity': '1.00%', 'speakers ': '500,000', 'is_official ': 'FALSE', 'official': ''}, {'alpha-2_code': 'PK', 'country_name_fr': 'Pakistan', 'popularity': '', 'speakers ': '', 'is_official ': 'FALSE', 'official': ''}]"
fre,fr,fr,fre,Français,Français,French,TRUE,fre,Langues latines,"Utilisation par pays
Europe - Langue officielle: Belgique, France, Luxembourg, Monaco, Suisse Andorre Statut officiel: - Amérique du Nord: Canada Langue officielle: Louisiane / USA (Statut officiel) - Océanie - Langue officielle: Polynésie française, Nouvelle-Calédonie, Vanuatu, Wallis et Futuna - Afrique - Langue officielle: Bénin, Burkina Faso, Burundi, Cameroun, République centrafricaine, Tchad, Comores, Congo, Djibouti, Gabon, Guinée, Côte d'Ivoire, Madagascar (Statut officiel), Département français de Mahoré, Mali, Mauritanie, Niger , Réunion, Rwanda, Sénégal, Seychelles (Statut officiel), Togo - Amérique centrale et du Sud - Langue officielle: Guyane française, Guadeloupe, Haïti, Martinique, Saint-Pierre et Miquelon

Contexte
Il appartient à la famille indo-européenne, groupe roman, et est la langue officielle de près de 200 millions de personnes. Il est parlé par plus de 124 millions de personnes, y compris des utilisateurs de langue seconde dans tous les pays. Il est largement compris dans le reste du monde, en particulier dans les pays qui ont ou ont des liens politiques ou économiques étroits avec la France, comme l'Algérie, le Maroc, le Liban, le Cambodge, le Vietnam, Tahiti et les Maldives. De manière significative, quarante-sept pays ont participé au 6e Sommet de la Francophonie (Le VIe Sommet francophone) qui s'est tenu à Cotonou, au Bénin, en décembre 1995. Le français est l'une des langues romanes, descendant du latin. L'apparition du latin en France (alors appelée Gaule) date de la conquête de la région par César dans la période 58-51 av. La Gaule est devenue l'une des provinces les plus riches et les plus importantes de l'Empire romain et le latin a remplacé les différentes langues celtiques (gauloises) comme langue du domaine. Un certain nombre de dialectes ont émergé mais l'histoire a favorisé le dialecte nordique appelé «la langue d'oïl», distingué de «l'occitan» ou «la langue d'oc», la langue du sud. Paris devint la capitale de la France au XIIe siècle et les Français parisiens prirent le dessus sur les autres. Aux 17e, 18e et 19e siècles, le français était une langue internationale prééminente.","[{'alpha-2_code': 'BE', 'country_name_fr': 'Belgique', 'popularity': '40.00%', 'speakers ': '4,800,000', 'is_official ': 'TRUE', 'official': 'Langue officielle'}, {'alpha-2_code': 'CH', 'country_name_fr': 'Suisse', 'popularity': '23.00%', 'speakers ': '1,500,000', 'is_official ': 'TRUE', 'official': 'Langue officielle. Quatre cantons sont unilingues français : Genève, Jura, Neuchâtel et Vaud.'}, {'alpha-2_code': 'EH', 'country_name_fr': 'Sahara Occidental', 'popularity': '', 'speakers ': '', 'is_official ': 'TRUE', 'official': ''}, {'alpha-2_code': 'FR', 'country_name_fr': 'France', 'popularity': '100.00%', 'speakers ': '66,000,000', 'is_official ': 'TRUE', 'official': 'Langue officielle'}, {'alpha-2_code': 'GN', 'country_name_fr': 'Guinée', 'popularity': '2.00%', 'speakers ': '272,600', 'is_official ': 'TRUE', 'official': 'Langue officielle'}, {'alpha-2_code': 'MR', 'country_name_fr': 'Mauritanie', 'popularity': '16.00%', 'speakers ': '705,500', 'is_official ': 'FALSE', 'official': ''}, {'alpha-2_code': 'NL', 'country_name_fr': 'Pays-Bas', 'popularity': '29.00%', 'speakers ': '5,014,100', 'is_official ': 'FALSE', 'official': ''}, {'alpha-2_code': 'AO', 'country_name_fr': 'Angola', 'popularity': '40.00%', 'speakers ': '', 'is_official ': 'FALSE', 'official': 'Parlé couramment dans le Nord-Ouest'}, {'alpha-2_code': 'AD', 'country_name_fr': 'Andorre', 'popularity': '70.00%', 'speakers ': '77,543', 'is_official ': 'FALSE', 'official': ''}, {'alpha-2_code': 'BJ', 'country_name_fr': 'Bénin', 'popularity': '100.00%', 'speakers ': '5,000,000', 'is_official ': 'TRUE', 'official': 'Langue officielle'}, {'alpha-2_code': 'CD', 'country_name_fr': 'République démocratique du Congo', 'popularity': '51.00%', 'speakers ': '42,500,000', 'is_official ': 'TRUE', 'official': ''}, {'alpha-2_code': 'US', 'country_name_fr': 'États-Unis', 'popularity': '1.00%', 'speakers ': '2,500,000', 'is_official ': 'FALSE', 'official': ''}, {'alpha-2_code': 'CA', 'country_name_fr': 'Canada', 'popularity': '50.00%', 'speakers ': '7,000,000', 'is_official ': 'TRUE', 'official': 'Langue officielle'}, {'alpha-2_code': 'PF', 'country_name_fr': 'Polynésie Française', 'popularity': '100.00%', 'speakers ': '', 'is_official ': 'FALSE', 'official': ''}, {'alpha-2_code': 'TN', 'country_name_fr': 'Tunisie', 'popularity': '52.00%', 'speakers ': '6,000,000', 'is_official ': 'FALSE', 'official': ''}, {'alpha-2_code': 'DZ', 'country_name_fr': 'Algérie', 'popularity': '80.00%', 'speakers ': '13,800,000', 'is_official ': 'FALSE', 'official': 'Largement compris et parlé'}, {'alpha-2_code': 'LU', 'country_name_fr': 'Luxembourg', 'popularity': '92.00%', 'speakers ': '552,000', 'is_official ': 'TRUE', 'official': 'Langue officielle'}, {'alpha-2_code': 'BF', 'country_name_fr': 'Burkina Faso', 'popularity': '100.00%', 'speakers ': '9,000,000', 'is_official ': 'TRUE', 'official': 'Langue officielle'}, {'alpha-2_code': 'CI', 'country_name_fr': ""Côte d'Ivoire"", 'popularity': '34.00%', 'speakers ': '8,200,000', 'is_official ': 'TRUE', 'official': 'Langue officielle\n69% de locutrices à Abidjan'}, {'alpha-2_code': 'GQ', 'country_name_fr': 'Guinée Équatoriale', 'popularity': '29.00%', 'speakers ': '', 'is_official ': 'TRUE', 'official': 'Langue officielle'}]"
dut,nl,nl,dut,Néerlandais,Nederlands,Dutch,TRUE,dut,Germanique,"Avec 25 millions de locuteurs maternels, le néerlandais est la troisième langue germanique, après l'anglais et l'allemand. Elle est langue officielle aux Pays-Bas et dans ses territoires d'outre mer, en Belgique et au Suriname. Elle est enfin langue régionale en France (Flandre), même s’il subsiste des différences entre flamand et néerlandais.
Sur le plan linguistique, le néerlandais se situe entre l’anglais et l’allemand, quoique plus proche de ce dernier.","[{'alpha-2_code': 'BE', 'country_name_fr': 'Belgique', 'popularity': '70.00%', 'speakers ': '8,400,000', 'is_official ': 'TRUE', 'official': 'Langue officielle'}, {'alpha-2_code': 'NL', 'country_name_fr': 'Pays-Bas', 'popularity': '100.00%', 'speakers ': '17,290,000', 'is_official ': 'TRUE', 'official': 'langue officielle.'}]"